카테고리,질문
관심사와 취미,취미를 통해 배운 기술이 있나요?
관심사와 취미,관심 있는 활동이 삶의 만족도를 어떻게 높여주나요?
관심사와 취미,취미와 관련된 동아리나 커뮤니티 활동을 하고 있나요?
관심사와 취미,여가 시간을 더 효율적으로 보내기 위한 계획이 있나요?
관심사와 취미,가장 최근에 새롭게 시작한 취미는 무엇인가요?
관심사와 취미,취미를 통해 배운 기술이 자신에게 어떤 영향을 미쳤나요?
관심사와 취미,자신의 관심사를 다른 사람들과 나눈 경험이 있나요?
관심사와 취미,"스포츠를 즐긴다면, 어떤 스포츠를 좋아하시나요?"
관심사와 취미,어떤 종류의 예술 활동에 관심이 있나요?
관심사와 취미,취미가 직업으로 연결된다면 어떨 것 같나요?
관심사와 취미,지금 하고 있는 취미 활동 중 가장 좋아하는 것은 무엇인가요?
관심사와 취미,취미와 관련된 기술을 배우는 데 있어 도움을 받은 사람이 있나요?
관심사와 취미,관심사를 직업으로 전환하는 데 가장 큰 장애물은 무엇인가요?
관심사와 취미,취미를 통해 삶의 질이 어떻게 향상되었나요?
관심사와 취미,어떤 취미 활동이 가장 행복감을 주는지 설명해 주세요.
관심사와 취미,취미와 관련된 도전을 극복한 경험이 있나요?
관심사와 취미,자신의 취미를 통해 다른 사람들과의 관계가 어떻게 변화했나요?
관심사와 취미,가장 영감을 받는 활동이나 장소는 무엇인가요?
관심사와 취미,취미를 통해 얻은 가장 큰 성취는 무엇인가요?
관심사와 취미,새로운 관심사를 발견하게 된 계기는 무엇인가요?
관심사와 취미,여행을 좋아하시나요? 그렇다면 어떤 종류의 여행을 선호하시나요?
관심사와 취미,관심 있는 취미 활동이 미래의 직업과 연관이 있나요?
관심사와 취미,"음악, 스포츠, 예술 등 특정 분야에 관심이 있나요?"
관심사와 취미,여가 시간에 가장 즐겨 하는 활동은 무엇인가요?
관심사와 취미,"시간이 제한적일 때, 어떤 취미 활동을 우선으로 하시나요?"
교육과정과 학업,학업 성과를 높이기 위해 시도한 새로운 전략이 있나요?
교육과정과 학업,추가적으로 배우고 싶은 기술이나 지식이 있나요?
교육과정과 학업,학교나 교육 과정에서 어려움을 겪은 적이 있나요?
교육과정과 학업,자격증 취득을 위해 계획 중인 것이 있나요?
교육과정과 학업,현재 어떤 학위를 취득하려고 하시나요?
교육과정과 학업,학습 목표를 설정하고 달성하는 과정에서 가장 어려웠던 점은 무엇인가요?
교육과정과 학업,과거 학습 경험에서 얻은 가장 큰 교훈은 무엇인가요?
교육과정과 학업,교육 외적으로 참여한 활동이 학업에 미친 영향은 무엇인가요?
교육과정과 학업,동료나 친구와 함께 학습하여 얻은 교훈은 무엇인가요?
교육과정과 학업,학교에서 제공한 리소스를 활용한 경험이 있나요?
교육과정과 학업,학업 중 자신의 가장 강력한 학습 스타일은 무엇인가요?
교육과정과 학업,가장 좋아하는 과목은 무엇인가요?
교육과정과 학업,평생 학습에 대해 어떻게 생각하시나요?
교육과정과 학업,현재 배우고 있는 내용이 직업 선택에 어떻게 도움이 된다고 생각하시나요?
교육과정과 학업,교육 이외의 경력을 위해 참여하고 있는 활동이 있나요?
교육과정과 학업,학교 외 학습에서 얻은 교훈이 있다면 무엇인가요?
교육과정과 학업,가장 최근에 학습한 내용 중 가장 기억에 남는 것은 무엇인가요?
교육과정과 학업,"가장 어려웠던 과목은 무엇이었고, 어떻게 극복하셨나요?"
교육과정과 학업,학습 환경을 최적화하기 위해 어떤 노력을 하셨나요?
교육과정과 학업,가장 도전적인 프로젝트를 성공적으로 완수한 경험은 무엇인가요?
교육과정과 학업,어떤 유형의 교육 방식이 자신에게 가장 잘 맞는다고 생각하시나요?
교육과정과 학업,교육 과정에서 추가적인 지원이 필요하다고 느낀 적이 있나요?
교육과정과 학업,온라인 학습이나 오프라인 강의 중 어떤 방식을 선호하시나요?
교육과정과 학업,공부하는 동안 동기부여를 유지하기 위한 방법은 무엇인가요?
교육과정과 학업,학교 외적으로 배우고 싶은 주제는 무엇인가요?
기술과 강점,본인의 기술이 다른 사람들에게 긍정적인 영향을 준 경험이 있나요?
기술과 강점,효율성을 높이기 위해 도입한 기술이나 방법이 있나요?
기술과 강점,기술적 한계를 극복하기 위해 어떻게 노력하셨나요?
기술과 강점,새로운 환경에 빠르게 적응하는 방법이 있다면 무엇인가요?
기술과 강점,어떤 기술이나 능력을 가장 자신 있다고 생각하나요?
기술과 강점,팀워크와 독립적인 작업 중 어떤 것을 더 선호하시나요?
기술과 강점,"창의적인 업무를 선호하시나요, 아니면 분석적인 업무를 선호하시나요?"
기술과 강점,책임감이 강하다고 느낀 경험이 있나요?
기술과 강점,동료와 협력하여 갈등을 해결한 경험이 있나요?
기술과 강점,기술 습득을 위한 외부 자원을 어떻게 활용하셨나요?
기술과 강점,기술적 발전이 커리어 목표에 미친 영향을 설명해 주세요.
기술과 강점,"다른 사람들과 비교했을 때, 본인의 강점은 무엇인가요?"
기술과 강점,문제를 창의적으로 해결한 경험을 공유해 주실 수 있나요?
기술과 강점,새로운 도구나 기술을 배울 때 가장 효과적인 학습 방법은 무엇인가요?
기술과 강점,어떤 상황에서 본인의 리더십을 발휘했다고 느낀 적이 있나요?
기술과 강점,현재 배우고 있는 기술 중 가장 자신 있는 것은 무엇인가요?
기술과 강점,팀원들과 협력하여 이룬 성공적인 경험이 있나요?
기술과 강점,어떤 상황에서 자신의 기술에 대한 자부심을 느끼시나요?
기술과 강점,문제를 해결할 때 어떤 접근 방식을 사용하는 편인가요?
기술과 강점,새로운 기술을 배우는 데 있어 흥미를 느끼나요?
기술과 강점,기술 습득에 있어 본인이 개선해야 할 점은 무엇인가요?
기술과 강점,스스로의 기술이 직업에서 어떤 가치를 더한다고 생각하나요?
기술과 강점,현재 강점으로 삼고 있는 기술을 어떻게 활용하고 싶으신가요?
기술과 강점,기술 습득을 위해 추가적으로 계획 중인 학습이 있나요?
기술과 강점,동료나 친구들로부터 자주 듣는 칭찬은 무엇인가요?
성격 및 특성,스트레스 상황에서의 대처 방식은 어떠신가요?
성격 및 특성,자신의 성격이 직업 선택에 어떻게 영향을 미쳤는지 설명해 주세요.
성격 및 특성,스스로를 동기부여하기 위해 사용하는 전략이 있나요?
성격 및 특성,다른 사람들과의 상호작용에서 강점이라고 생각하는 것은 무엇인가요?
성격 및 특성,자신의 가치관이 삶의 선택에 어떻게 영향을 미쳤는지 설명해 주세요.
성격 및 특성,자신의 성격이 사회적 관계 형성에 어떤 영향을 준다고 생각하시나요?
성격 및 특성,어떤 상황에서 가장 자신감을 느끼시나요?
성격 및 특성,스트레스를 받을 때 가장 먼저 하게 되는 행동은 무엇인가요?
성격 및 특성,"스스로를 외향적이라고 생각하시나요, 아니면 내향적이라고 생각하시나요?"
성격 및 특성,성격적으로 본인이 가장 자랑스러워하는 점은 무엇인가요?
성격 및 특성,스트레스 상황에서 본인을 진정시키는 방법이 있나요?
성격 및 특성,문제를 해결하는 방식에서 창의적인 접근법을 선호하시나요?
성격 및 특성,팀에서 자신의 역할을 어떻게 정의하셨나요?
성격 및 특성,다양한 상황에서 리더십을 발휘한 경험이 있나요?
성격 및 특성,자신이 겪었던 성격적인 갈등을 해결한 방법은 무엇인가요?
성격 및 특성,성격의 약점이라고 생각하는 점을 어떻게 보완하시나요?
성격 및 특성,타인에게 가장 긍정적인 영향을 미쳤던 순간은 언제인가요?
성격 및 특성,자신감이 필요한 순간에 스스로를 어떻게 격려하시나요?
성격 및 특성,시간 관리를 위해 사용하는 방법이 있나요?
성격 및 특성,문제를 해결할 때 분석적인 접근과 창의적인 접근 중 어느 쪽을 선호하시나요?
성격 및 특성,타인의 의견을 받아들이는 데 있어 본인의 태도는 어떤가요?
성격 및 특성,어려운 결정을 내려야 할 때 어떤 프로세스를 따르시나요?
성격 및 특성,자신의 성격적 강점을 직장에서 어떻게 활용할 수 있다고 생각하시나요?
성격 및 특성,다른 사람들과 일할 때 가장 즐거운 부분은 무엇인가요?
성격 및 특성,성격 변화나 개선을 위해 노력한 경험이 있나요?
장애물 및 도전,과거의 실패 경험이 현재의 자신에게 어떤 영향을 주었나요?
장애물 및 도전,목표 달성을 위해 새로운 전략을 세운 경험이 있나요?
장애물 및 도전,자신의 한계를 극복하기 위해 어떤 노력을 했나요?
장애물 및 도전,도전을 극복한 후 느꼈던 가장 큰 성취감은 무엇인가요?
장애물 및 도전,장애물을 극복하기 위해 어떤 자원을 활용하셨나요?
장애물 및 도전,도전적인 상황에서 배운 가장 중요한 교훈은 무엇인가요?
장애물 및 도전,목표 달성에 방해가 되었던 주된 요소는 무엇인가요?
장애물 및 도전,동료나 친구의 지원이 도전 극복에 어떤 도움을 주었나요?
장애물 및 도전,앞으로 직면할 수 있는 가장 큰 도전은 무엇이라고 예상하시나요?
장애물 및 도전,목표를 향해 꾸준히 나아가기 위한 비결이 있다면 무엇인가요?
장애물 및 도전,장애물을 극복한 경험이 현재의 자신에게 어떤 영향을 미쳤나요?
장애물 및 도전,미래에 어떤 도전을 시도해보고 싶으신가요?
장애물 및 도전,어려운 상황에서도 동기부여를 유지하기 위한 방법은 무엇인가요?
장애물 및 도전,목표를 이루는 과정에서 가장 힘들었던 순간은 언제였나요?
장애물 및 도전,자신에게 도전 과제를 설정하는 방법은 무엇인가요?
장애물 및 도전,"과거에 목표를 이루기 위해 실패한 경험이 있다면, 이를 어떻게 극복하셨나요?"
장애물 및 도전,현재 직면하고 있는 가장 큰 문제는 무엇인가요?
장애물 및 도전,현재의 도전을 극복하기 위한 구체적인 계획이 있나요?
장애물 및 도전,진로를 결정하는 데 가장 어려운 점은 무엇인가요?
장애물 및 도전,자원을 최대한 활용하기 위해 어떤 노력을 하시나요?
장애물 및 도전,어려운 상황을 극복한 경험이 있나요?
장애물 및 도전,어떤 종류의 지원이나 자원이 필요하다고 느끼시나요?
장애물 및 도전,목표를 이루기 위해 계획하고 있는 구체적인 단계가 있나요?
장애물 및 도전,현재 목표를 이루는 데 있어 가장 큰 장애물은 무엇인가요?
장애물 및 도전,도움이 필요할 때 주로 누구에게 의지하시나요?
진로 희망,"사람들과의 소통이 중요한 직업을 선호하시나요, 아니면 독립적인 직업을 선호하시나요?"
진로 희망,어떤 직업이 자신에게 가장 적합하다고 생각하나요?
진로 희망,직업 선택에서 안정성과 흥미 중 어느 것을 더 중요하게 생각하나요?
진로 희망,스스로 좋아하는 일을 직업으로 삼는 것에 대해 어떻게 생각하시나요?
진로 희망,어린 시절 꿈꾸던 직업이 있었나요? 그 직업에 대한 생각이 지금도 유효한가요?
진로 희망,이전 상담에서 얻은 정보를 통해 진로 목표를 수정했나요?
진로 희망,직업 선택에서 가장 중요하게 생각하는 가치는 무엇인가요?
진로 희망,자신의 성격과 직업 선택이 어떻게 연결된다고 생각하나요?
진로 희망,원하는 직업을 위해 지금 무엇을 준비하고 있나요?
진로 희망,사회적 영향력이나 인정이 중요한 직업을 선호하시나요?
진로 희망,당신의 꿈의 직업이나 경력 경로는 무엇인가요?
진로 희망,어떤 산업이나 분야가 가장 흥미롭나요?
진로 희망,일하고 싶은 특정 회사나 조직이 있나요?
진로 희망,자영업이나 창업을 고려한 적이 있나요?
진로 희망,어떤 유형의 직무에서 일하는 것이 가장 편안하게 느껴지나요?
진로 희망,장기적으로 이루고 싶은 커리어 목표는 무엇인가요?
진로 희망,현재 고려하고 있는 직업 선택지 중 가장 끌리는 이유는 무엇인가요?
진로 희망,직업 선택에서 일과 삶의 균형은 얼마나 중요한가요?
진로 희망,다양한 직업 중 한 가지를 선택해야 한다면 무엇을 선택하시겠습니까?
진로 희망,자신이 선호하는 직업 유형을 세 가지로 요약한다면 무엇인가요?
진로 희망,본인이 상상하는 이상적인 직업 환경은 어떤 모습인가요?
진로 희망,진로를 결정할 때 가족의 의견이 중요한 영향을 미쳤나요?
진로 희망,직업 선택 시 가장 피하고 싶은 요소는 무엇인가요?
진로 희망,꿈꾸는 직업을 이루기 위해 지금 가장 중요한 단계는 무엇인가요?
진로 희망,자신의 미래 직업에 대해 얼마나 구체적으로 계획하고 있나요?
